id,Name,Date (UTC),Description,Url,Tax Code
prod_UFHtU7wiFZrkhj,ISPVP 2026 Fundraising Donation,3/30/26 21:25,Support ISPVP 2026 conference. Any amount is appreciated.,,
prod_UFHsbPzSdgBu7A,ISPVP 2026 Late Student,3/30/26 21:24,Late registration ticket for students,,
prod_UFHrvYiU0TdAow,ISPVP 2026 Late Research,3/30/26 21:23,Late registration ticket for research staff / postdocs,,
prod_UFHrW6D5njxaeZ,ISPVP 2026 Late Regular,3/30/26 21:23,Late registration ticket for regular attendees,,
prod_UFHq8qEMapdwoF,ISPVP 2026 General Student,3/30/26 21:23,General ticket for students,,
prod_UFHqvvzjT2o6LB,ISPVP 2026 General Research,3/30/26 21:22,General ticket for research staff / postdocs,,
prod_UFHphoSgZml3Zr,ISPVP 2026 General Regular,3/30/26 21:22,General ticket for regular attendees,,
prod_UFHpuuzK74mzbX,ISPVP 2026 Early Student,3/30/26 21:21,Early bird ticket for students,,
prod_UFHokF1jORQKHt,ISPVP 2026 Early Research,3/30/26 21:20,Early bird ticket for research staff / postdocs,,
prod_UFHmKXqKuBJjLR,ISPVP 2026 Early Regular,3/30/26 21:19,Early bird ticket for regular attendees,,